tweet_id,emotion,content
1751713870,boredom,@jodimariethomas hey Jodi.. what's up??ugg.. im bored.. i just made a sundae.. c u monday.. ( hahaha it rymed...) loll. cu in school
1695054674,love,Very good morning! Coffee and a taylor swift cd starts it off
1753115218,relief,@glennguan your test works fine for me  tweetdeck is so cool eh?
1752822506,relief,Studying like crazy in hopes of acing all of my exams!!!!!
1752773422,enthusiasm,"@Ms_Mary_Typhoid Are you coming to the wedding?  I want all of his friends to be there?    @TheDeadpool Right, sugar?"
1696043975,love,&lt;3 alayellow
1960124303,neutral,"Academy Rector with tons of tutors looks like the way to go, since all the good Trix draw engines and mana accel is gone."
1966218964,boredom,I'm so tired. I don't get how I am. I sat on the lawn mower and didn't push the whole damn thing.
1753869024,worry,"@JamesHancox i don't know why but, i can only find miss matched socks during winter. i mean, where do they all go?"
1965335930,hate,can't upload a picture. I already hate twitter
1961909603,enthusiasm,Stood outsiden got the WORST butterflies everrrrr!
1695375082,neutral,"@Decordiva Yep, getting some material together for my 1st USA pitch to realtors. Haven't quite worked out the angle yet, but it'll come"
1752320728,neutral,@penguinm That comment was just to ..well you know...to not reply to it.
1751952613,love,"@zownder Hahah, thanks for the Tradewinds Odyssey bump."
1751884973,happiness,Just at Starbucks with Farrah!
1694183657,neutral,@mohdrafie Theres no such thing
1752535472,boredom,@PurpleFoodie yeah...I hope it turns out... 20 more minutes!
1693957440,love,"@urbanpinkpixie Susan Egan, I love her! And yeah, it said I would have a pleasant trip."
1957744150,empty,"Woe, it's definitely NO fun to travel first class with a bike. You have to fight your way through 7 coaches 'til you reach your seat"
1751919618,relief,@asiareeves I'm just glad it turned out okay for you!
1961570593,surprise,There is a sadness in the air at school  but I got two awards!!
1961875139,hate,This is slowly going to drive me crazy i hate leaky faucets they're frustrating! I'm ready for a nap but there's no naptime at work
1750928268,relief,@vogonpoetry42 At least there's no denying nerd is part of it!
1963569138,empty,@TreeinCally  He's got adjusting his mate's online shop... Zzzzzzzzzzzzzzz... Boring...
1694789658,happiness,yeah! I'm going to Makati Cinema Square with my dad later. haha!
1751500740,worry,@karramandi Where r u Yvonne?? Haven't seen u in the google groups in a day or so. Miss ya.
1957730729,empty,so bored...
1752918064,happiness,so bryan was at the sweet 15 and i didnt think we were gonna talk but towards the end of the night we talked
1957589597,anger,"Did a historical Jesus ever exist? Im finding it hard to prove, its all hearsay accounts ... it bugs me ..."
1695619285,enthusiasm,never twittered b4 but here i am wondering what to do next...jared?!?!
1695251049,worry,"Monday mornin', back to work today. Good thing I live my job."
1958066406,neutral,needs 1000 words for 502 part 2 .... then freedom ..... until another few assignments and exams
1957249452,sadness,"@kesoleil Oh man, Did Yogg today. Worse than last week."
1753029316,neutral,@eboni_ife not to forget cinnamon!
1957207486,empty,@Steinmoney      You'll be missed!!  Bring me back  a keychain!
1753790753,relief,@tessajames01 cool i wear black most of the time when i go out
1957188950,sadness,home from school had the shitest day today
1695731693,love,Today is my Mother's birthday- Happy Birthday &amp; I love you! She is an angel whom has helped me so much during this time of my life
1957460469,worry,"@Wykrzyknik uff, ble litt trist av � lese den siste tweetsen din  the challenge prooved too be tough!! :'("
1694384688,fun,@beijingboyce  I am seriously contemplating timing my next trip home to catch his next fight. They show it in cinemas. Live! With beer!
1695344846,surprise,"@cameronfrye Awww, that's amazing though! I've never been to a SoCo or JM concert...but once Zac hanson gave me his drumstick!"
1694771088,surprise,"nvm, lexi's playlist is working its magic"
1961521707,empty,Can't even tell you how much this hair dresser is pissssssing me off she has no clue wtf I'm asking her to do..so I'm expecting the worst
1963409963,empty,Just came back from school.... Packing for my dad's house
1957477724,anger,My stomach is all EXPLODE from the wendys  why is everything that tastes good bad for you?
1961573504,surprise,gah! didn't realize my meeting was from 9-12
1753031206,love,"Welcoming new #followers: @chillisoft, @Hansieboy, @keylman  @luongdat, @pleasehelpmenow &amp; @FLWbooks. Thanks for the love. Tweet on!"
1752871380,sadness,bye daddy!! see you on tuesday
1957588348,boredom,@solobasssteve I'm with you there - filing is so much less fun than sorting cos you still have to look at it &amp; hunt down details
1962310128,hate,Ready to kill myself  i hate history
1960956204,empty,@annakayh your not in school
1695657297,happiness,death cab for cutie and slouchy barets  its a good way to start the day.
1957501257,boredom,My brother just woke me up to help him with his homework. I'm not happy
1694109928,relief,Ill have a photo up tomorrow! Kay
1752774291,neutral,@noesh leyendo
1961569799,anger,@aranarose Murphy's Law?  Sorry that your computer is not cooperating when you have lots of work. My kids are .. http://tinyurl.com/km235x
1961224347,boredom,Its seriously quiet and lonely here without Bunny
1694401634,worry,is watching wolverine at last.
1751430555,love,@Oprah Happy mother's day Oprah.  You're a mom to your girls too!
1694905087,neutral,"@Geelong_FC sounds good  maybe some player quotes, photos etc I'm living in WA atm so would love bits and pieces from the Ady and Sun"
1695249907,enthusiasm,"@tamij Have a good day.  I'm checking out Hugh today. Also, be on lookout for best &quot;cassoulet&quot; recipe you will have ever tasted!"
1957188633,hate,Doing a mass cleanout of my room before rearranging it. Just sent mother out to buy me a bin and a bookshelf since mine sucks. Bad mood
1962235394,empty,@_Glitter_  kk but 4 sum reason its not lettin me vote 4 them
1752052047,relief,Yay got the Internet on my itouch working
1753789282,worry,"@jonesyladdd SAME. its just not happening, and im going out too!. UH-OH."
1957379307,fun,Walking to work on a gloriously sunny day. Going to be a good weekend in which I will burn as always even with suncream on  #fb
1962652280,boredom,@vmlemon i dont like #kde since ver. 4.0 its like vista  #fail
1753434076,fun,@ohaiijess it would be cool if they had people make videos of themselves miming the song and make one big video  so EVERYONE can be in it.
1751322906,love,Dave looks so cute in the dark
1694146045,neutral,"@loveivy Oh, I see. Daily life shots? It'll be interesting as well."
1695803076,fun,"@CoachCharrise its funny, I didn't even know it was there!"
1965988154,anger,"@PENLDN just got in, gonna go upto bed in a sec, not drunk! I'm disgusted with myself  haha"
1753292226,relief,@firedwarftj i was right about the wave off
1752823791,surprise,@brabakr @Elikapeka @BeachMomOf2 Oh Duh....I see that now .....thank you....
1960711232,sadness,the columbus blue jackes may be movieing to anew city to play at  thats sad news
1752822438,anger,Just sittin here waitin for my coffee to be full grown on farm town before going to bed
1957410954,empty,is tired of being tired
1964034674,anger,@FafsaHelp i don't know what lender it was? yea these people definitely sucked butt toes. NOT friendly or helpful.
1962069581,enthusiasm,"my mouth is sore  I have to wear these stupid retainers so my teeth don't go crooked!...in other news, I got a new swimsuit for laps!"
1752506292,love,happy mother's day!
1965295438,boredom,TGIF... Hubby dragged me out to buy car parts. I am tired n cranky
1965017645,boredom,my brother left me for the day now I am here by myself
1964993119,sadness,i hate when i paint my nails because then i cant suck my thumb because it tastes bad
1965525688,empty,my bf had to go to her dads for the week end. i will have 2 full days of bordom.
1961219902,enthusiasm,@JanaiChristian While im stuck INSIDE in Elk Grove Village working all day   Someone should enjoy it!
1965554037,worry,@mileycyrus i bet you miss trace loads
1963508853,empty,"@VANS_66 I haven't had slip-ons in years, since my checkered days. Matter of fact I only have my torn up all black classics."
1961477134,boredom,The gigantic initial inertial to get oneself to work after a deadline
1964326224,surprise,"@JSNorwood oh, are we not doing that anymore?"
1694015825,neutral,"@erickaxx it would hurt only when you touch it or when it gets hit. But when you don't, it won't  but after a month it wouldn't hurt na!"
1753744886,fun,@chasepino ur funny  gnight
1753256885,empty,"@capricorn_one ok, I realise your up early because you've joined the cult of mac, nvm"
1964534599,sadness,@Jesusfreak1900 probably.  sucks for you.
1753886824,surprise,@MissxMarisa Then I guess that makes me Dot?
1966096234,sadness,"Sh t, I'm getting even more sad. I'm currently at the library and j think it'll be the last one tooooo"
1694727799,relief,yay my research paper is finally 4 and a half pages&lt;3 not going on bus was not bad after all
1961227194,hate,Ugh i hate not having my car!! i miss you my little ford focus!!!
1965599330,empty,"@shanselman still no class loaders, or even custom assembly loaders"
1750928472,fun,waiting for JONAS to come on
1753328713,fun,@gulpanag watching dor on utv movies again great performance
1752943030,happiness,Alright gang. Gotta go park with family for an hour. Back then  Mwahs to yu if you head to bed before then
1694422150,worry,"@lexia first ripping off the bbc design, now bebo? For shame.."
1961190230,relief,time for work!
1962710492,worry,@iamdiddy me.  confused about a guy...he's great but why am I pushing him away?
1963647690,empty,Woke up... cleaned... Aunt Emmas... Walmart.. Commissary... Now its time for a nap!!!.. then off to work
1965251625,fun,I'm SO thinking about skippin out to NY in the morning. . . but all of my plans were for tonight  well . . . most of them anyway.
1694051260,love,http://twitpic.com/4j99z - a gift from my boyfriend... this little guy keeps me company at night
1964982051,empty,because it is too hot i am sleeping with the window open. just means all the noise will make me up early
1963280484,happiness,omg a rat... ewwwww. omg i cant wait for tha marra.. so ecxcited. annabel cant go tho
1960137406,anger,"@Greenwichlad Oh let me clarify,know lots of nice people who live there, but thought it always was a breeding ground 4 BNP"
1753293896,neutral,@Lesley_M make sure you watch in HD
1958038404,worry,"Forced myself out of bed this morning, but failed to cycle in. Damn."
1958088999,happiness,@Jessums31 yup its working. they couldn't recover anything on it though
1694492283,surprise,Ohhh Ladyhawke is on channel 4  I sort of have a thing for Rutger Hauer http://twitpic.com/4jbzv
1962941194,hate,@LadyLucius Oh eww that is suck!
1695884965,happiness,@daniamiwa Were you at the parade yesterday at Powderhorn? Guessing Ava and Bella were similarly mesmerized by the whimsical fairyness
